{
  "schemaVersion": "0.1",
  "typeId": "Game.GetTransformPosition",
  "title": "Get Transform Position",
  "category": "Game/Transform",
  "description": "Returns world Transform.position.",
  "executor": "Game.GetTransformPosition",
  "inputs": [
    {
      "id": "target",
      "kind": "value",
      "type": "UIBinding<Transform>",
      "required": true,
      "source": "property"
    }
  ],
  "outputs": [
    {
      "id": "value",
      "kind": "value",
      "type": "Vector3"
    }
  ],
  "properties": [
    {
      "id": "target",
      "required": true,
      "type": "UIBinding<Transform>"
    }
  ]
}
