{
  "schemaVersion": "0.1",
  "typeId": "Vector.Lerp",
  "title": "Vector Lerp",
  "category": "Vector",
  "description": "Linearly interpolates between two Vector3 values.",
  "executor": "Vector.Lerp",
  "inputs": [
    {
      "id": "a",
      "kind": "value",
      "type": "Vector3",
      "required": true,
      "source": "propertyOrConnection"
    },
    {
      "id": "b",
      "kind": "value",
      "type": "Vector3",
      "required": true,
      "source": "propertyOrConnection"
    },
    {
      "id": "t",
      "kind": "value",
      "type": "float",
      "required": true,
      "source": "propertyOrConnection"
    }
  ],
  "outputs": [
    {
      "id": "result",
      "kind": "value",
      "type": "Vector3"
    }
  ],
  "properties": [
    {
      "id": "a",
      "required": false,
      "type": "Vector3",
      "defaultValue": [
        0.0,
        0.0,
        0.0
      ]
    },
    {
      "id": "b",
      "required": false,
      "type": "Vector3",
      "defaultValue": [
        0.0,
        0.0,
        0.0
      ]
    },
    {
      "id": "t",
      "required": false,
      "type": "float",
      "defaultValue": 0.0
    }
  ]
}
