{
  "schemaVersion": "0.1",
  "typeId": "Game.SetTransformLocalPosition",
  "title": "Set Transform Local Position",
  "category": "Game/Transform",
  "description": "Sets Transform.localPosition.",
  "executor": "Game.SetTransformLocalPosition",
  "inputs": [
    {
      "id": "execIn",
      "kind": "exec"
    },
    {
      "id": "target",
      "kind": "value",
      "type": "UIBinding<Transform>",
      "required": true,
      "source": "property"
    },
    {
      "id": "value",
      "kind": "value",
      "type": "Vector3",
      "required": true,
      "source": "propertyOrConnection"
    }
  ],
  "outputs": [
    {
      "id": "execOut",
      "kind": "exec"
    }
  ],
  "properties": [
    {
      "id": "target",
      "required": true,
      "type": "UIBinding<Transform>"
    },
    {
      "id": "value",
      "required": false,
      "type": "Vector3",
      "defaultValue": [
        0,
        0,
        0
      ]
    }
  ]
}
