{
  "schemaVersion": "0.1",
  "typeId": "Game.SafeTeleportRigidbody2D",
  "title": "Safe Teleport Rigidbody2D",
  "category": "Game/Physics2D",
  "description": "Safely teleports a Rigidbody2D and optionally preserves its velocities.",
  "executor": "Game.SafeTeleportRigidbody2D",
  "inputs": [
    {
      "id": "execIn",
      "kind": "exec"
    },
    {
      "id": "target",
      "kind": "value",
      "type": "Binding<Rigidbody2D>",
      "required": true,
      "source": "propertyOrConnection"
    },
    {
      "id": "position",
      "kind": "value",
      "type": "Vector2",
      "required": true,
      "source": "propertyOrConnection"
    },
    {
      "id": "rotationDegrees",
      "kind": "value",
      "type": "float",
      "required": false,
      "source": "propertyOrConnection"
    },
    {
      "id": "setRotation",
      "kind": "value",
      "type": "bool",
      "required": false,
      "source": "propertyOrConnection"
    },
    {
      "id": "preserveLinearVelocity",
      "kind": "value",
      "type": "bool",
      "required": false,
      "source": "propertyOrConnection"
    },
    {
      "id": "preserveAngularVelocity",
      "kind": "value",
      "type": "bool",
      "required": false,
      "source": "propertyOrConnection"
    }
  ],
  "outputs": [
    {
      "id": "execOut",
      "kind": "exec"
    }
  ],
  "properties": [
    {
      "id": "target",
      "type": "Binding<Rigidbody2D>",
      "required": false
    },
    {
      "id": "position",
      "type": "Vector2",
      "required": false,
      "defaultValue": [0, 0]
    },
    {
      "id": "rotationDegrees",
      "type": "float",
      "required": false,
      "defaultValue": 0
    },
    {
      "id": "setRotation",
      "type": "bool",
      "required": false,
      "defaultValue": false
    },
    {
      "id": "preserveLinearVelocity",
      "type": "bool",
      "required": false,
      "defaultValue": false
    },
    {
      "id": "preserveAngularVelocity",
      "type": "bool",
      "required": false,
      "defaultValue": false
    }
  ],
  "tags": [
    "physics2d",
    "rigidbody2d",
    "teleport"
  ]
}
