{
  "schemaVersion": "0.1",
  "typeId": "BehaviorTree.GetBlackboardBool",
  "title": "Get Blackboard Bool",
  "category": "BehaviorTree/Blackboard",
  "description": "Reads a bool value from a bound BehaviorTreeRunner Blackboard.",
  "executor": "BehaviorTree.GetBlackboardBool",
  "inputs": [
    {
      "id": "target",
      "kind": "value",
      "type": "Binding<BehaviorTreeRunner>",
      "required": true,
      "source": "property"
    },
    {
      "id": "key",
      "kind": "value",
      "type": "string",
      "required": true,
      "source": "propertyOrConnection"
    }
  ],
  "outputs": [
    {
      "id": "value",
      "kind": "value",
      "type": "bool"
    },
    {
      "id": "success",
      "kind": "value",
      "type": "bool"
    }
  ],
  "properties": [
    {
      "id": "target",
      "type": "Binding<BehaviorTreeRunner>",
      "required": true
    },
    {
      "id": "key",
      "type": "string",
      "required": false
    }
  ],
  "tags": [
    "behavior tree",
    "blackboard",
    "bool"
  ]
}
