{
  "schemaVersion": "0.1",
  "typeId": "UI.SetCanvasGroupAlpha",
  "title": "Set Canvas Group Alpha",
  "category": "UI",
  "description": "Sets alpha on a bound CanvasGroup.",
  "executor": "UI.SetCanvasGroupAlpha",
  "inputs": [
    {
      "id": "execIn",
      "kind": "exec"
    },
    {
      "id": "target",
      "kind": "value",
      "type": "Binding<CanvasGroup>",
      "required": true,
      "source": "property"
    },
    {
      "id": "value",
      "kind": "value",
      "type": "float",
      "required": true,
      "source": "propertyOrConnection"
    }
  ],
  "outputs": [
    {
      "id": "execOut",
      "kind": "exec"
    }
  ],
  "properties": [
    {
      "id": "target",
      "type": "Binding<CanvasGroup>",
      "required": true
    },
    {
      "id": "value",
      "type": "float",
      "required": false,
      "defaultValue": 1
    }
  ]
}
