{
  "schemaVersion": "0.1",
  "typeId": "Game.TranslateTransform",
  "title": "Translate Transform",
  "category": "Game/Transform",
  "description": "Moves a Transform by a translation in self or world space.",
  "executor": "Game.TranslateTransform",
  "inputs": [
    {
      "id": "execIn",
      "kind": "exec"
    },
    {
      "id": "target",
      "kind": "value",
      "type": "UIBinding<Transform>",
      "required": true,
      "source": "property"
    },
    {
      "id": "translation",
      "kind": "value",
      "type": "Vector3",
      "required": true,
      "source": "propertyOrConnection"
    },
    {
      "id": "relativeToSelf",
      "kind": "value",
      "type": "bool",
      "source": "propertyOrConnection"
    }
  ],
  "outputs": [
    {
      "id": "execOut",
      "kind": "exec"
    }
  ],
  "properties": [
    {
      "id": "target",
      "required": true,
      "type": "UIBinding<Transform>"
    },
    {
      "id": "translation",
      "required": false,
      "type": "Vector3",
      "defaultValue": [
        0,
        0,
        0
      ]
    },
    {
      "id": "relativeToSelf",
      "required": false,
      "type": "bool",
      "defaultValue": true
    }
  ]
}
